,Text,,Label,
"bayes.training(""",The team's recent victories have raised suspicions of foul play.,""",",positive,)
"bayes.training(""","Despite their recent loss, the team's morale remains high.",""",",positive,)
"bayes.training(""",Rumors of match-fixing have cast a shadow over the team's recent successes.,""",",negative,)
"bayes.training(""",The unexpected resignation of the coach has left the team in disarray.,""",",negative,)
"bayes.training(""",Speculations about doping allegations have led to tensions within the team.,""",",negative,)
"bayes.training(""",The role of sports in promoting physical fitness and teamwork is invaluable.,""",",positive,)
"bayes.training(""",Sports competitions foster a sense of community and camaraderie among participants.,""",",positive,)
"bayes.training(""",Team sports encourage collaboration and communication skills.,""",",positive,)
"bayes.training(""",Sportsmanship and fair play are essential values in athletics.,""",",positive,)
"bayes.training(""",Sports events provide entertainment and excitement for spectators.,""",",positive,)
"bayes.training(""",Controversies and scandals often tarnish the reputation of professional sports.,""",",negative,)
"bayes.training(""",Sports organizations prioritize profits over the well-being of athletes.,""",",negative,)
"bayes.training(""",The pressure to win at all costs can lead to unethical behavior in sports.,""",",negative,)
"bayes.training(""",Sports culture perpetuates harmful stereotypes and unrealistic body ideals.,""",",negative,)
"bayes.training(""",Sports injuries can have long-term consequences on athletes' health and well-being.,""",",negative,)
"bayes.training(""",The impact of sports on society is complex and multifaceted.,""",",positive,)
"bayes.training(""",Sports leagues should do more to address issues of inclusivity and diversity.,""",",positive,)
"bayes.training(""",The commercialization of sports undermines the spirit of fair competition.,""",",negative,)
"bayes.training(""",Sports endorsements by celebrities and athletes influence consumer behavior.,""",",positive,)
"bayes.training(""",Sports events can unite people from diverse backgrounds under a common interest.,""",",positive,)
"bayes.training(""",Participation in sports can instill valuable life skills such as discipline and resilience.,""",",positive,)
"bayes.training(""",The emphasis on winning in sports detracts from the joy of participation.,""",",negative,)
"bayes.training(""",Sports facilities and programs should be accessible to all members of the community.,""",",positive,)
"bayes.training(""",Sports broadcasting often prioritizes high-profile events over grassroots initiatives.,""",",negative,)
"bayes.training(""",The obsession with sports statistics detracts from the essence of the game.,""",",negative,)
"bayes.training(""",Sports fandom can create a sense of belonging and identity for individuals.,""",",positive,)
"bayes.training(""",Corruption and bribery scandals tarnish the integrity of sports organizations.,""",",negative,)
"bayes.training(""",The culture of sports encourages risk-taking and pushing physical limits.,""",",positive,)
"bayes.training(""",Sports media perpetuates unrealistic expectations of athletes and their performances.,""",",negative,)
"bayes.training(""",Sports diplomacy has the potential to bridge cultural and political divides.,""",",positive,)
"bayes.training(""",Commercialization has turned sports into a lucrative industry driven by profit.,""",",negative,)
"bayes.training(""",Sports injuries highlight the need for better safety measures and protocols.,""",",negative,)
"bayes.training(""",Sports provide a platform for social activism and raising awareness about important issues.,""",",positive,)
"bayes.training(""",The emphasis on winning can create a toxic environment in youth sports.,""",",negative,)
"bayes.training(""",Sports scholarships offer opportunities for education and upward mobility.,""",",positive,)
"bayes.training(""",Scandals and controversies overshadow the positive contributions of sports.,""",",negative,)
"bayes.training(""",Sports events have the power to inspire and motivate individuals to achieve greatness.,""",",positive,)
"bayes.training(""",The hyper-competitiveness of sports can lead to burnout and mental health issues.,""",",negative,)
"bayes.training(""",Sports programs in schools should receive more funding and support.,""",",positive,)
"bayes.training(""",The commercialization of sports has led to the commodification of athletes.,""",",negative,)
"bayes.training(""",Participation in sports can foster lifelong friendships and social connections.,""",",positive,)
"bayes.training(""",Sports organizations must do more to address issues of corruption and integrity.,""",",negative,)
"bayes.training(""",The culture of sports perpetuates harmful gender stereotypes and discrimination.,""",",negative,)
"bayes.training(""",Sports events contribute to local economies and tourism.,""",",positive,)
"bayes.training(""",The pressure to succeed in sports can have detrimental effects on mental health.,""",",negative,)
"bayes.training(""",Sports broadcasting has become saturated with sensationalism and drama.,""",",negative,)
"bayes.training(""","Sports promote values of teamwork, discipline, and perseverance.",""",",positive,)
"bayes.training(""",Cheating and doping scandals undermine the integrity of sports competitions.,""",",negative,)
"bayes.training(""",The pursuit of excellence in sports requires dedication and sacrifice.,""",",positive,)
"bayes.training(""",Sports participation among children promotes physical health and social skills.,""",",positive,)
"bayes.training(""",The hyper-competitiveness of sports can lead to unethical behavior and rule-breaking.,""",",negative,)
"bayes.training(""",Sports fandom can foster a sense of community and belonging among fans.,""",",positive,)
"bayes.training(""",Sports events offer a platform for showcasing cultural diversity and heritage.,""",",positive,)
"bayes.training(""",The pressure to win in sports can overshadow the enjoyment of playing the game.,""",",negative,)
"bayes.training(""",Sports programs in schools play a crucial role in character development and leadership.,""",",positive,)
"bayes.training(""",The commercialization of sports has led to exploitation and commodification of athletes.,""",",negative,)
